{
  "schema": "kxm.roadmap.v1",
  "updated": "2026-10-11",
  "goal": "Record the local-first KXM shape that this checkout can show, and track the proposal and queue items the implementation tracker actually records.",
  "constraints": [
    "SQLite remains the hub store recorded in this checkout.",
    "The docs site binds only a tailnet address and is not published on a public edge.",
    "A draft plan does not change a phase gate unless the tracker selects the slice.",
    "No hostname, address, tenant name, email, or secret is written into this state file."
  ],
  "contacts": [],
  "contacts_comment": "The operator fills contacts. Do not invent contacts.",
  "history": [
    {
      "date": "2026-09-27",
      "line": "Draft plan for bare kxm first-run, sequenced after role-authority P3-P7."
    },
    {
      "date": "2026-09-27",
      "line": "Companion draft for Studio hub screens, sharing the first-run sequence gate."
    },
    {
      "date": "2026-09-27",
      "line": "P2 role authority landed (#343, published 0.7.131): the v2 files are the only dispatch source, roster.yaml and the transport recipes are gone."
    },
    {
      "date": "2026-09-27",
      "line": "P4 opt-in fallback walk records routing.route_switched and continues the attempt."
    },
    {
      "date": "2026-09-27",
      "line": "docs/operations.md indexes the six state roots and the cross-box peer attach recipe."
    },
    {
      "date": "2026-09-28",
      "line": "Deep pass: greenfield stub, MG0 evidence, and an untracked python tree observed in the operator's primary worktree; hub cloud binding inventoried."
    },
    {
      "date": "2026-09-28",
      "line": "P3 tool policy landed (#378, v0.7.169). Cross-host P0 bind unblocked (#348, #375, #376). MG1 is off-repo. CI pause text retired."
    },
    {
      "date": "2026-09-28",
      "line": "Land follow-up: verify names the failing check, and UNKNOWN merge state is polled until it resolves."
    },
    {
      "date": "2026-09-28",
      "line": "kxm supervise stores lane, pull request, CI, and backoff state and resumes it after a restart."
    },
    {
      "date": "2026-10-11",
      "line": "The kxm.config.v1 terminal editor now shares one owner-validated surface across the CLI and OMP/Pi."
    },
    {
      "date": "2026-10-11",
      "line": "loop-dispatch completed: a live writer and both critics settled from verified drives, and the parent improvement report included all three lane attempts."
    },
    {
      "date": "2026-10-11",
      "line": "MG1 Python control-plane source is checked in without host or guest install changes. OpenAPI and the Studio path inventory come from FastAPI, and PostgreSQL-backed CI is required. Node and SQLite remain authoritative."
    }
  ],
  "architecture": {
    "verified": "2026-10-11",
    "docs": [
      "docs/architecture/index.md",
      "docs/architecture/platform.md",
      "docs/architecture/inventory.md",
      "docs/architecture/access.md",
      "docs/architecture/authentication.md",
      "docs/architecture/agent-path.md",
      "docs/architecture/hosted-direction.md"
    ],
    "drift": [
      {
        "claim": "the S3 test title in the tracker matches a test title in this checkout",
        "page": "docs/roadmap/phases/05-per-tenant-hosting.md",
        "status": "mismatch"
      }
    ]
  },
  "improvements": [],
  "phases": [
    {
      "id": "loop",
      "slug": "planner-loop",
      "title": "Planner loop and lanes",
      "goal": "The kxm verbs that let the planner dispatch a writer into a worktree lane and land its branch without just recipes: lane, land, assign, docs, and bounded one-shot steps.",
      "source": "plans/plan-lane-cli.md",
      "blockers": [],
      "questions": [
        "The proof model behind kxm assign (backlog S11) is still an operator decision."
      ],
      "tasks": [
        {
          "id": "loop-lane",
          "title": "kxm lane create, list, status, drop, run with --brief and --lane",
          "status": "done",
          "evidence": "test/core/cli.test.ts",
          "planSection": "plans/plan-lane-cli.md#2-target-surface",
          "template": "feature",
          "detail": "ready"
        },
        {
          "id": "loop-land",
          "title": "kxm land: verify, docs, push, pr, rebase, unblock, merge, release, milestone",
          "status": "done",
          "evidence": "test/core/pr-land.test.ts",
          "planSection": "plans/plan-landing-gates.md#2-target",
          "template": "feature",
          "detail": "ready"
        },
        {
          "id": "loop-assign",
          "title": "kxm assign over the assignment runner, seven verbs, argv pass-through",
          "status": "done",
          "evidence": "test/core/cli.test.ts",
          "template": "feature",
          "detail": "scoped"
        },
        {
          "id": "loop-docs",
          "title": "Tailnet docs site, roadmap generator, and kxm docs build and serve",
          "status": "done",
          "evidence": "plans/kxm-roadmap/update-dashboard.mjs",
          "template": "feature",
          "detail": "scoped"
        },
        {
          "id": "loop-timeouts",
          "title": "Configurable one-shot step timeout, cancel recovery, and the three one-step workflows",
          "status": "done",
          "evidence": "test/core/engine.test.ts",
          "planSection": "plans/plan-lane-cli.md#4-found-during-the-first-dispatch-2026-09-25",
          "template": "bug-fix",
          "detail": "ready"
        },
        {
          "id": "loop-dispatch",
          "title": "Dispatch the writer and both critics through one-step workflows and surface their lane attempts in the parent report",
          "status": "done",
          "evidence": "plans/evidence/loop-dispatch-2026-10-11.json",
          "doneCriterion": "One real unit ran the writer and both critics through the one-step workflows. Each attempt settled from a verified drive receipt, and kxm improve report from the parent checkout included all three lane attempt rows. Transport recipes were already retired in #343.",
          "evidenceNeeded": "Satisfied by plans/evidence/loop-dispatch-2026-10-11.json: three verified workflow drive receipts and parent report counts.",
          "template": "feature",
          "detail": "scoped"
        },
        {
          "id": "loop-land-followup",
          "title": "kxm land follow-up: verify failure detail (S19) and UNKNOWN merge state (S22)",
          "status": "done",
          "evidence": "test/core/pr-land.test.ts",
          "doneCriterion": "A failing verify names the failing lines and a log path; the rebase stage polls UNKNOWN to a known state and rebases when BEHIND.",
          "evidenceNeeded": "test/core/pr-land.test.ts cases for both, and one landing that hit each path.",
          "template": "bug-fix",
          "detail": "scoped"
        },
        {
          "id": "loop-supervise",
          "title": "kxm supervise persists in-flight lanes, pull request and CI state, and backoff timers (S20)",
          "status": "done",
          "evidence": "test/core/supervise.test.ts",
          "planSection": "plans/plan-lane-cli.md#6-persistent-supervisor-state",
          "doneCriterion": "A new process loads the same in-flight lanes, last-seen pull request and CI states, and backoff timers, and a tick after the backoff resumes that lane.",
          "evidenceNeeded": "A restart-resume test that writes the state, exits, and reads it back from another process.",
          "template": "feature",
          "detail": "scoped"
        }
      ]
    },
    {
      "id": "omp",
      "slug": "role-authority",
      "title": "Role authority from the v2 policy draft",
      "goal": "Promote the passive kxm.role.v2 and kxm.model.v2 draft to the single role authority, retire kxm.role.v1, routes.yaml roles, roster.yaml and the code defaults, give agents a role reference, then add the opt-in fallback walk, tool-policy enforcement, provenance, and effort validation.",
      "source": "plans/plan-omp-config-alignment.md",
      "blockers": [],
      "questions": [
        "P2 landed in #343, P4 ships the error classifier with the walk, and P3 tool policy landed in #378 (v0.7.169). Section 7 still asks whether kxm plugin install --omp should write modelRoles from the role files. The engine can settle a real reviewer outcome (#363, #368). Backlog S33 records one truthful critic BLOCK on the vision lane. That settlement is not loop-dispatch."
      ],
      "tasks": [
        {
          "id": "omp-p1",
          "title": "P1 promote the draft: schemas live, models and roles rewritten to v2, v1 deleted",
          "status": "done",
          "evidence": "test/core/policy-draft.test.ts",
          "planSection": "plans/plan-omp-config-alignment.md#5-phases",
          "doneCriterion": "just verify green; every .kxm/roles and .kxm/models file validates through validatePolicyDraft with the developer ceilings; role list, get, add, modify, remove read and write v2 only.",
          "evidenceNeeded": "The validator test named in the P1 row and the CHANGELOG entry.",
          "template": "feature",
          "detail": "ready"
        },
        {
          "id": "omp-p2",
          "title": "P2 cut the loader and engine over to the v2 files",
          "status": "done",
          "evidence": "test/core/roster-policy.test.ts",
          "planSection": "plans/plan-omp-config-alignment.md#5-phases",
          "doneCriterion": "roster-policy.mjs and engine.ts read roles and routes from the v2 files at origin/main; roster.yaml and the justfile literals are gone.",
          "evidenceNeeded": "test/core/roster-policy.test.ts rewritten, one engine test per refusal path.",
          "template": "feature",
          "detail": "ready"
        },
        {
          "id": "omp-p3",
          "title": "P3 tool policy enforcement",
          "status": "done",
          "evidence": "test/core/engine.test.ts",